{
  "tool": "terminalizer",
  "os": "linux",
  "shell": "pwsh",
  "scenario": "launch-exit",
  "verdict": "working",
  "reason": "",
  "gif": "assets/terminalizer/gif/linux-pwsh-launch-exit.gif",
  "run_url": "https://github.com/YoraiLevi/testing-area/actions/runs/35570461361",
  "extra": {
    "tool_version": "latest (npm 0.12.0)",
    "omp_version": "omp/18.2.7"
  }
}
