{
  "tool": "console2svg",
  "os": "linux",
  "shell": "zsh",
  "scenario": "launch-exit",
  "verdict": "working",
  "reason": "",
  "gif": "assets/console2svg/gif/linux-zsh-launch-exit.gif",
  "run_url": "https://github.com/YoraiLevi/testing-area/actions/runs/35544253596",
  "extra": {
    "tool_version": "v0.9.3",
    "omp_version": "omp/18.2.6"
  }
}
