{
  "tool": "termsvg",
  "os": "linux",
  "shell": "bash",
  "scenario": "typing-demo",
  "verdict": "working",
  "reason": "omp TUI input not reachable headlessly; per scenarios.md S4, sample prompt typed at the shell prompt (keystroke-animation fallback)",
  "gif": "assets/termsvg/gif/linux-bash-typing-demo.gif",
  "run_url": "https://github.com/YoraiLevi/testing-area/actions/runs/35533474649",
  "extra": {
    "tool_version": "v0.11.0",
    "omp_version": "omp/18.2.6"
  }
}
