{
  "tool": "console2svg",
  "os": "macos",
  "shell": "zsh",
  "scenario": "typing-demo",
  "verdict": "working",
  "reason": "console2svg has no headless TUI input driver; sample prompt animated as a typed command line via -c (shell-prompt fallback per scenarios.md)",
  "gif": "assets/console2svg/macos-zsh-typing-demo.gif",
  "run_url": "https://github.com/YoraiLevi/testing-area/actions/runs/35436212639",
  "extra": {
    "tool_version": "v0.9.3",
    "omp_version": "omp/18.2.6"
  }
}
