{
  "tool": "terminalizer",
  "os": "linux",
  "shell": "bash",
  "scenario": "tui-splash",
  "verdict": "working",
  "reason": "",
  "gif": "assets/terminalizer/linux-bash-tui-splash.gif",
  "run_url": "https://github.com/YoraiLevi/testing-area/actions/runs/35524971941",
  "extra": {
    "tool_version": "latest (npm 0.12.0)",
    "omp_version": "omp/18.2.6"
  }
}
