{
  "tool": "evp",
  "os": "linux",
  "shell": "pwsh",
  "scenario": "help-tour",
  "verdict": "working",
  "reason": "",
  "gif": "assets/evp/gif/linux-pwsh-help-tour.gif",
  "run_url": "https://github.com/YoraiLevi/testing-area/actions/runs/35576002624",
  "extra": {
    "svg": "assets/evp/svg/linux-pwsh-help-tour.svg",
    "tool_version": "v0.19.0",
    "omp_version": "omp/18.2.7"
  }
}
