{
  "tool": "acast",
  "os": "linux",
  "shell": "bash",
  "scenario": "typing-demo",
  "verdict": "working",
  "reason": "scenarios.md S4 shell-prompt fallback: sample prompt typed at the shell prompt (acast cannot inject into the omp TUI input box headlessly)",
  "gif": "assets/acast/linux-bash-typing-demo.gif",
  "run_url": "https://github.com/YoraiLevi/testing-area/actions/runs/35524971977",
  "extra": {
    "tool_version": "v0.4.0 (agg v1.9.0)",
    "omp_version": "omp/18.2.6"
  }
}
