{
  "tool": "powersession",
  "os": "windows",
  "shell": "pwsh",
  "scenario": "launch-exit",
  "verdict": "working",
  "reason": "",
  "gif": "assets/powersession/windows-pwsh-launch-exit.gif",
  "run_url": "https://github.com/YoraiLevi/testing-area/actions/runs/35528564958",
  "extra": {
    "tool_version": "v0.1.16 (agg v1.9.0)",
    "omp_version": "omp/18.2.6"
  }
}
