{
  "tool": "termsvg",
  "os": "linux",
  "shell": "pwsh",
  "scenario": "tui-splash",
  "verdict": "broken",
  "reason": "omp TUI could not be driven/quit headlessly via termsvg PTY capture; no valid GIF produced",
  "gif": null,
  "run_url": "https://github.com/YoraiLevi/testing-area/actions/runs/35569668272",
  "extra": {
    "tool_version": "v0.11.0",
    "omp_version": "omp/18.2.7"
  }
}
