{
  "tool": "terminalizer",
  "os": "windows",
  "shell": "pwsh",
  "scenario": "help-tour",
  "verdict": "broken",
  "reason": "no valid GIF produced in CI",
  "gif": null,
  "run_url": "https://github.com/YoraiLevi/testing-area/actions/runs/35528564966",
  "extra": {
    "tool_version": "latest (npm 0.12.0)",
    "omp_version": "omp/18.2.6"
  }
}
