{
  "tool": "foley",
  "os": "macos",
  "shell": "zsh",
  "scenario": "launch-exit",
  "verdict": "working",
  "reason": "",
  "gif": "assets/foley/gif/macos-zsh-launch-exit.gif",
  "run_url": "https://github.com/YoraiLevi/testing-area/actions/runs/35569668217",
  "extra": {
    "tool_version": "foley v0.1.0",
    "omp_version": "omp/18.2.7"
  }
}
