{
  "tool": "vhs",
  "os": "linux",
  "shell": "zsh",
  "scenario": "tui-splash",
  "verdict": "working",
  "reason": "",
  "gif": "assets/vhs/linux-zsh-tui-splash.gif",
  "run_url": "https://github.com/YoraiLevi/testing-area/actions/runs/35434442088",
  "extra": {
    "tool_version": "v0.11.0",
    "omp_version": "omp/18.2.6"
  }
}
