{
  "tool": "vhs",
  "os": "windows",
  "shell": "pwsh",
  "scenario": "help-tour",
  "verdict": "not-applicable",
  "reason": "VHS records via ttyd, which has no Windows build (Unix-only); the capture pipeline cannot run on Windows.",
  "gif": null,
  "run_url": "https://github.com/YoraiLevi/testing-area/actions/runs/35540912293",
  "extra": {
    "tool_version": "v0.11.0",
    "omp_version": "omp/18.2.6"
  }
}
