{
  "tool": "acast",
  "os": "linux",
  "shell": "zsh",
  "scenario": "help-tour",
  "verdict": "working",
  "reason": "",
  "gif": "assets/acast/gif/linux-zsh-help-tour.gif",
  "run_url": "https://github.com/YoraiLevi/testing-area/actions/runs/35544253440",
  "extra": {
    "tool_version": "v0.4.0 (agg v1.9.0)",
    "omp_version": "omp/18.2.6"
  }
}
