{
  "tool": "betamax",
  "os": "macos",
  "shell": "zsh",
  "scenario": "tui-splash",
  "verdict": "working",
  "reason": "omp TUI ignores headless quit keystrokes; a background SIGINT->SIGTERM->SIGKILL watchdog ends the omp process so Betamax can finalize the splash recording (scenarios.md S3)",
  "gif": "assets/betamax/macos-zsh-tui-splash.gif",
  "run_url": "https://github.com/YoraiLevi/testing-area/actions/runs/35438572381",
  "extra": {
    "tool_version": "betamax-v0.1.21",
    "omp_version": "omp/18.2.6"
  }
}
