{
  "tool": "asciinema",
  "os": "linux",
  "shell": "pwsh",
  "scenario": "tui-splash",
  "verdict": "working",
  "reason": "",
  "gif": "assets/asciinema/linux-pwsh-tui-splash.gif",
  "run_url": "https://github.com/YoraiLevi/testing-area/actions/runs/35528564961",
  "extra": {
    "tool_version": "v3.2.1 + agg v1.9.0",
    "omp_version": "omp/18.2.6"
  }
}
