{
  "tool": "termsvg",
  "os": "linux",
  "shell": "zsh",
  "scenario": "launch-exit",
  "verdict": "working",
  "reason": "",
  "gif": "assets/termsvg/gif/linux-zsh-launch-exit.gif",
  "run_url": "https://github.com/YoraiLevi/testing-area/actions/runs/35540912306",
  "extra": {
    "tool_version": "v0.11.0",
    "omp_version": "omp/18.2.6"
  }
}
