{
  "tool": "vhs",
  "os": "macos",
  "shell": "zsh",
  "scenario": "typing-demo",
  "verdict": "working",
  "reason": "",
  "gif": "assets/vhs/macos-zsh-typing-demo.gif",
  "run_url": "https://github.com/YoraiLevi/testing-area/actions/runs/35439744379",
  "extra": {
    "tool_version": "v0.11.0",
    "omp_version": "omp/18.2.6"
  }
}
